{
  "fromDate": "2020-04-06",
  "toDate": "2021-04-05",
  "contractorName": "ContractorA",
  "employerRef": "123/AB56797",
  "periodData": [
    {
      "deductionAmount": 355.00,
      "deductionFromDate": "2020-06-06",
      "deductionToDate": "2020-07-05",
      "costOfMaterials": 35.00,
      "grossAmountPaid": 1457.00
    }
  ]
}
